{
  "$schema": "https://json-schema.org/draft/2020-12/schema",
  "$id": "https://thai-nine.local/schemas/asset-provenance.schema.json",
  "title": "Asset Provenance",
  "type": "object",
  "additionalProperties": false,
  "required": ["schemaVersion", "lessonId", "generatedAt", "assets"],
  "properties": {
    "schemaVersion": { "const": 1 },
    "lessonId": { "type": "string", "pattern": "^M\\d{2}-L\\d{3}$" },
    "generatedAt": { "type": "string", "minLength": 1 },
    "assets": {
      "type": "array",
      "minItems": 1,
      "items": {
        "type": "object",
        "additionalProperties": false,
        "required": ["assetId", "kind", "sourceUrl", "license", "usage"],
        "properties": {
          "assetId": { "type": "string", "minLength": 1 },
          "kind": { "enum": ["image", "icon", "video"] },
          "sourceUrl": { "type": "string", "pattern": "^https://" },
          "license": { "type": "string", "minLength": 1 },
          "usage": { "type": "string", "minLength": 1 },
          "query": { "type": "string", "minLength": 1 },
          "sourcePolicy": { "const": "internet-first" },
          "rationale": { "type": "string", "minLength": 1 },
          "sourceHints": {
            "type": "array",
            "items": { "type": "string", "minLength": 1 }
          },
          "aiFallbackPrompt": { "type": "string", "minLength": 1 }
        }
      }
    }
  }
}
